"Company","Founder","Website","Email","LinkedIn","Country","Industry","Why They Need Zwima AI","Best Outreach Angle","Estimated Monthly Spend","Final Score"
"acemate.ai","Antong Yin / Paul Herman / Jan Tiegges","https://acemate.ai","hello@acemate.ai","https://www.linkedin.com/company/acemateai","Germany","AI / EdTech SaaS","acemate is already an AI-native learning platform that transforms documents into exams, summaries, flashcards, mind maps and personalized tutoring for universities and educators. They likely need reliable multi-model access, document-processing prompts, cost control and API experimentation as usage grows.","Position Zwima AI as a predictable multi-model API and credits layer for AI tutoring, document transformation, educator automation and university-facing product experiments.","€500+","91.4"
"Zeevan GmbH","Chien-Hao Hsu","https://zeevan.com","office@zeevan.com","https://www.linkedin.com/in/chienhaohsu","Austria","China E-commerce / Digital Marketing Agency","Zeevan is a founder-led China e-commerce and digital marketing agency working with Alibaba, Tmall, JD, WeChat, Douyin, Bytedance and Alibaba Cloud. Their daily work requires bilingual content, campaign research, reporting, translation and client communication across Europe and China.","Lead with a practical AI workbench for China-market campaign content, Chinese/German/English translation, Alibaba/Tmall/WeChat research, client reports and proposal drafting.","€200","88.0"
"TRAKKER","Yuting Peng / Alex Nikonov / Ahmed Ali","https://www.trakker.tech","alex@trakker.tech","https://www.linkedin.com/company/trakker-tech","Germany","Event Analytics / Lead Generation Software","TRAKKER is an AI-powered event analytics startup that generates automated trade-show leads, visitor profiles and CRM-ready insights. It likely needs AI for lead scoring, follow-up personalization, CRM enrichment, multilingual exhibitor reports and product iteration.","Pitch Zwima AI as a multi-model layer for lead intelligence, personalized follow-up copy, exhibitor reporting, CRM enrichment and fast AI experiments without managing many provider accounts.","€200","87.2"
"ECENTIME","Yangke Sun / Yijun Chen / Hu Zhang","https://ectime.co","contact@ecentime.com","https://www.linkedin.com/company/ecentime/","France","Franco-Chinese E-commerce / Shopping Community","ECENTIME connects Chinese consumers in Europe with local brands and uses predictive software, data mining and shopping recommendations. The platform has heavy multilingual content, product recommendations, influencer/community workflows and customer-facing shopping guidance.","Offer Zwima AI for Chinese/French product copy, deal descriptions, recommendation text, influencer briefs, customer support, brand onboarding and multi-model testing for commerce content.","€200","84.8"
"STAiiRS","Guanghui Li","https://staiirs.com","admin@staiirs.com","https://www.linkedin.com/in/guanghuili","France","China-Europe Digital Marketing Agency","STAiiRS is a small founder-led China-Europe digital marketing agency using Baidu, Google, Microsoft Ads, WeChat, TikTok/Douyin and Chinese social platforms. Their pain is repeated multilingual ad copy, SEO/SEA research, reporting and client communication.","Position Zwima AI as a shared AI workspace for Baidu/Google research, Chinese-European ad copy, WeChat/TikTok content, reporting summaries and multilingual client deliverables.","€200","83.6"
